{
  "id": "sup-dry-goods",
  "schemaVersion": "1",
  "name": {
    "zh": "宏达粮油调味批发",
    "en": "Hongda Dry Goods & Condiments",
    "uk": "Hongda Бакалія та приправи"
  },
  "contact": {
    "phone": "+86-21-5555-0202",
    "email": "sales@hongda.example.cn"
  },
  "skus": [
    {
      "skuId": "HD-SALT-500G",
      "ingredientRef": "ing-salt",
      "packageSize": 500,
      "packageUnit": "g",
      "price": { "amount": 2.5, "currency": "CNY" },
      "moq": 20,
      "leadTimeDays": 2,
      "isPreferred": true
    },
    {
      "skuId": "HD-OIL-5L",
      "ingredientRef": "ing-cooking-oil",
      "packageSize": 5,
      "packageUnit": "l",
      "price": { "amount": 68, "currency": "CNY" },
      "moq": 2,
      "leadTimeDays": 2,
      "isPreferred": true
    }
  ]
}
